post	user
this has been happening to me a lot lately I've been staying up till 6am 7am and anxiety has just been really bad.just want to feel like myself again	user1
And my mom is so scared and wondering why I’m not eating a lot and she doesn’t know she and my family are the reason I’m still awake crying till 6:40	user2
and the intrusive thoughts that everyone would be better off without you	user3
Same babe, I’ve had about 3 mental breakdowns this week. I can feel it getting bad again and I can’t stop it.	user4
I'm literally nocturnal now it's bad I wake up when it's getting dark	user5
